[
  {
    "id": "koo-001",
    "faceA": "산타",
    "faceB": "딸기",
    "locale": "ko-KR",
    "editionId": "codename-app-ko-original-v1",
    "sourceReference": "codename-app project original list (2026-09)"
  },
  {
    "id": "koo-002",
    "faceA": "농구",
    "faceB": "전설",
    "locale": "ko-KR",
    "editionId": "codename-app-ko-original-v1",
    "sourceReference": "codename-app project original list (2026-09)"
  },
  {
    "id": "koo-003",
    "faceA": "이끼",
    "faceB": "풍선",
    "locale": "ko-KR",
    "editionId": "codename-app-ko-original-v1",
    "sourceReference": "codename-app project original list (2026-09)"
  },
  {
    "id": "koo-004",
    "faceA": "가방",
    "faceB": "외계인",
    "locale": "ko-KR",
    "editionId": "codename-app-ko-original-v1",
    "sourceReference": "codename-app project original list (2026-09)"
  },
  {
    "id": "koo-005",
    "faceA": "중력",
    "faceB": "전화",
    "locale": "ko-KR",
    "editionId": "codename-app-ko-original-v1",
    "sourceReference": "codename-app project original list (2026-09)"
  },
  {
    "id": "koo-006",
    "faceA": "구름",
    "faceB": "편지",
    "locale": "ko-KR",
    "editionId": "codename-app-ko-original-v1",
    "sourceReference": "codename-app project original list (2026-09)"
  },
  {
    "id": "koo-007",
    "faceA": "정원",
    "faceB": "태양",
    "locale": "ko-KR",
    "editionId": "codename-app-ko-original-v1",
    "sourceReference": "codename-app project original list (2026-09)"
  },
  {
    "id": "koo-008",
    "faceA": "소나무",
    "faceB": "이집트",
    "locale": "ko-KR",
    "editionId": "codename-app-ko-original-v1",
    "sourceReference": "codename-app project original list (2026-09)"
  },
  {
    "id": "koo-009",
    "faceA": "기차",
    "faceB": "깃발",
    "locale": "ko-KR",
    "editionId": "codename-app-ko-original-v1",
    "sourceReference": "codename-app project original list (2026-09)"
  },
  {
    "id": "koo-010",
    "faceA": "지갑",
    "faceB": "감옥",
    "locale": "ko-KR",
    "editionId": "codename-app-ko-original-v1",
    "sourceReference": "codename-app project original list (2026-09)"
  },
  {
    "id": "koo-011",
    "faceA": "조개",
    "faceB": "강",
    "locale": "ko-KR",
    "editionId": "codename-app-ko-original-v1",
    "sourceReference": "codename-app project original list (2026-09)"
  },
  {
    "id": "koo-012",
    "faceA": "숲",
    "faceB": "다리",
    "locale": "ko-KR",
    "editionId": "codename-app-ko-original-v1",
    "sourceReference": "codename-app project original list (2026-09)"
  },
  {
    "id": "koo-013",
    "faceA": "독일",
    "faceB": "시계",
    "locale": "ko-KR",
    "editionId": "codename-app-ko-original-v1",
    "sourceReference": "codename-app project original list (2026-09)"
  },
  {
    "id": "koo-014",
    "faceA": "영국",
    "faceB": "모래",
    "locale": "ko-KR",
    "editionId": "codename-app-ko-original-v1",
    "sourceReference": "codename-app project original list (2026-09)"
  },
  {
    "id": "koo-015",
    "faceA": "이",
    "faceB": "수영",
    "locale": "ko-KR",
    "editionId": "codename-app-ko-original-v1",
    "sourceReference": "codename-app project original list (2026-09)"
  },
  {
    "id": "koo-016",
    "faceA": "동화",
    "faceB": "떡",
    "locale": "ko-KR",
    "editionId": "codename-app-ko-original-v1",
    "sourceReference": "codename-app project original list (2026-09)"
  },
  {
    "id": "koo-017",
    "faceA": "바나나",
    "faceB": "기타",
    "locale": "ko-KR",
    "editionId": "codename-app-ko-original-v1",
    "sourceReference": "codename-app project original list (2026-09)"
  },
  {
    "id": "koo-018",
    "faceA": "여우",
    "faceB": "게",
    "locale": "ko-KR",
    "editionId": "codename-app-ko-original-v1",
    "sourceReference": "codename-app project original list (2026-09)"
  },
  {
    "id": "koo-019",
    "faceA": "거울",
    "faceB": "궁전",
    "locale": "ko-KR",
    "editionId": "codename-app-ko-original-v1",
    "sourceReference": "codename-app project original list (2026-09)"
  },
  {
    "id": "koo-020",
    "faceA": "호수",
    "faceB": "생일",
    "locale": "ko-KR",
    "editionId": "codename-app-ko-original-v1",
    "sourceReference": "codename-app project original list (2026-09)"
  },
  {
    "id": "koo-021",
    "faceA": "상어",
    "faceB": "피자",
    "locale": "ko-KR",
    "editionId": "codename-app-ko-original-v1",
    "sourceReference": "codename-app project original list (2026-09)"
  },
  {
    "id": "koo-022",
    "faceA": "비밀",
    "faceB": "토끼",
    "locale": "ko-KR",
    "editionId": "codename-app-ko-original-v1",
    "sourceReference": "codename-app project original list (2026-09)"
  },
  {
    "id": "koo-023",
    "faceA": "플라스틱",
    "faceB": "유니콘",
    "locale": "ko-KR",
    "editionId": "codename-app-ko-original-v1",
    "sourceReference": "codename-app project original list (2026-09)"
  },
  {
    "id": "koo-024",
    "faceA": "평화",
    "faceB": "병",
    "locale": "ko-KR",
    "editionId": "codename-app-ko-original-v1",
    "sourceReference": "codename-app project original list (2026-09)"
  },
  {
    "id": "koo-025",
    "faceA": "시장",
    "faceB": "괴물",
    "locale": "ko-KR",
    "editionId": "codename-app-ko-original-v1",
    "sourceReference": "codename-app project original list (2026-09)"
  },
  {
    "id": "koo-026",
    "faceA": "모자",
    "faceB": "돈",
    "locale": "ko-KR",
    "editionId": "codename-app-ko-original-v1",
    "sourceReference": "codename-app project original list (2026-09)"
  },
  {
    "id": "koo-027",
    "faceA": "늑대",
    "faceB": "농장",
    "locale": "ko-KR",
    "editionId": "codename-app-ko-original-v1",
    "sourceReference": "codename-app project original list (2026-09)"
  },
  {
    "id": "koo-028",
    "faceA": "런던",
    "faceB": "눈물",
    "locale": "ko-KR",
    "editionId": "codename-app-ko-original-v1",
    "sourceReference": "codename-app project original list (2026-09)"
  },
  {
    "id": "koo-029",
    "faceA": "국수",
    "faceB": "비행기",
    "locale": "ko-KR",
    "editionId": "codename-app-ko-original-v1",
    "sourceReference": "codename-app project original list (2026-09)"
  },
  {
    "id": "koo-030",
    "faceA": "선물",
    "faceB": "장갑",
    "locale": "ko-KR",
    "editionId": "codename-app-ko-original-v1",
    "sourceReference": "codename-app project original list (2026-09)"
  },
  {
    "id": "koo-031",
    "faceA": "줄",
    "faceB": "우주",
    "locale": "ko-KR",
    "editionId": "codename-app-ko-original-v1",
    "sourceReference": "codename-app project original list (2026-09)"
  },
  {
    "id": "koo-032",
    "faceA": "항구",
    "faceB": "야구",
    "locale": "ko-KR",
    "editionId": "codename-app-ko-original-v1",
    "sourceReference": "codename-app project original list (2026-09)"
  },
  {
    "id": "koo-033",
    "faceA": "포도",
    "faceB": "양",
    "locale": "ko-KR",
    "editionId": "codename-app-ko-original-v1",
    "sourceReference": "codename-app project original list (2026-09)"
  },
  {
    "id": "koo-034",
    "faceA": "온도",
    "faceB": "치즈",
    "locale": "ko-KR",
    "editionId": "codename-app-ko-original-v1",
    "sourceReference": "codename-app project original list (2026-09)"
  },
  {
    "id": "koo-035",
    "faceA": "시",
    "faceB": "요리사",
    "locale": "ko-KR",
    "editionId": "codename-app-ko-original-v1",
    "sourceReference": "codename-app project original list (2026-09)"
  },
  {
    "id": "koo-036",
    "faceA": "마법",
    "faceB": "은",
    "locale": "ko-KR",
    "editionId": "codename-app-ko-original-v1",
    "sourceReference": "codename-app project original list (2026-09)"
  },
  {
    "id": "koo-037",
    "faceA": "커피",
    "faceB": "창문",
    "locale": "ko-KR",
    "editionId": "codename-app-ko-original-v1",
    "sourceReference": "codename-app project original list (2026-09)"
  },
  {
    "id": "koo-038",
    "faceA": "새벽",
    "faceB": "로마",
    "locale": "ko-KR",
    "editionId": "codename-app-ko-original-v1",
    "sourceReference": "codename-app project original list (2026-09)"
  },
  {
    "id": "koo-039",
    "faceA": "나무",
    "faceB": "겨울",
    "locale": "ko-KR",
    "editionId": "codename-app-ko-original-v1",
    "sourceReference": "codename-app project original list (2026-09)"
  },
  {
    "id": "koo-040",
    "faceA": "신화",
    "faceB": "섬",
    "locale": "ko-KR",
    "editionId": "codename-app-ko-original-v1",
    "sourceReference": "codename-app project original list (2026-09)"
  },
  {
    "id": "koo-041",
    "faceA": "자",
    "faceB": "안경",
    "locale": "ko-KR",
    "editionId": "codename-app-ko-original-v1",
    "sourceReference": "codename-app project original list (2026-09)"
  },
  {
    "id": "koo-042",
    "faceA": "머리",
    "faceB": "트로피",
    "locale": "ko-KR",
    "editionId": "codename-app-ko-original-v1",
    "sourceReference": "codename-app project original list (2026-09)"
  },
  {
    "id": "koo-043",
    "faceA": "텐트",
    "faceB": "놀이터",
    "locale": "ko-KR",
    "editionId": "codename-app-ko-original-v1",
    "sourceReference": "codename-app project original list (2026-09)"
  },
  {
    "id": "koo-044",
    "faceA": "터널",
    "faceB": "양말",
    "locale": "ko-KR",
    "editionId": "codename-app-ko-original-v1",
    "sourceReference": "codename-app project original list (2026-09)"
  },
  {
    "id": "koo-045",
    "faceA": "라디오",
    "faceB": "왕",
    "locale": "ko-KR",
    "editionId": "codename-app-ko-original-v1",
    "sourceReference": "codename-app project original list (2026-09)"
  },
  {
    "id": "koo-046",
    "faceA": "음악",
    "faceB": "낙타",
    "locale": "ko-KR",
    "editionId": "codename-app-ko-original-v1",
    "sourceReference": "codename-app project original list (2026-09)"
  },
  {
    "id": "koo-047",
    "faceA": "팝콘",
    "faceB": "주문",
    "locale": "ko-KR",
    "editionId": "codename-app-ko-original-v1",
    "sourceReference": "codename-app project original list (2026-09)"
  },
  {
    "id": "koo-048",
    "faceA": "사과",
    "faceB": "메달",
    "locale": "ko-KR",
    "editionId": "codename-app-ko-original-v1",